{
  "$schema": "https://json-schema.org/draft/2020-12/schema",
  "$id": "project.schema.json",
  "title": "SlideProject",
  "type": "object",
  "required": ["specVersion", "id", "title", "status", "updatedAt"],
  "properties": {
    "specVersion": { "type": "string", "const": "1.0.0" },
    "id": { "type": "string", "pattern": "^[a-z0-9-]+$" },
    "title": { "type": "string", "minLength": 1 },
    "description": { "type": "string" },
    "theme": { "type": "string", "default": "default" },
    "aspectRatio": { "type": "string", "default": "16/9" },
    "style": {
      "type": "string",
      "enum": ["formal", "tech", "whiteboard"],
      "description": "整體視覺風格，大綱階段與使用者確認：formal 正式（簡潔排版、SVG 與 Mermaid 預設樣式）、tech 科技（深色卡片、架構圖、程式碼、可用 3D 氛圍頁）、whiteboard 白板手繪（<RoughSketch> 與 Mermaid look: 'handDrawn'）"
    },
    "status": {
      "type": "string",
      "enum": ["initialized", "outlined", "drafted", "visualized", "exported", "failed"]
    },
    "pagesCount": { "type": "integer", "minimum": 1 },
    "export": {
      "type": "object",
      "properties": {
        "pdfPath": { "type": "string" },
        "exportedAt": { "type": "string", "format": "date-time" },
        "sizeBytes": { "type": "integer" }
      }
    },
    "updatedAt": { "type": "string", "format": "date-time" },
    "updatedBy": { "type": "string", "enum": ["user", "agent"] }
  },
  "additionalProperties": false
}
